{
  "contract": "kujo.workcell.work-package",
  "contract_version": "1.0",
  "package_id": "pkg-workcell-hello-001",
  "workflow_ref": {"id": "workcell-execution-gate", "version": "1"},
  "run_ref": {"id": "wc-fixture-001", "attempt": 1},
  "step_ref": {"id": "bounded-execution", "sequence": 1},
  "source": {"repository": "/private/tmp/workcell-fixture", "commit": "e6a34b7bd3015a950bbb220f04bbb2c7d92940a5", "dirty_allowed": false},
  "execution": {"runtime_backend": "docker", "workspace_strategy": "git-worktree", "command": ["sh", "-lc", "printf 'hello from Workcell\\n' > hello.txt"], "resource_limits": {"timeout_ms": 60000, "max_output_bytes": 4000000}, "network_mode": "none"},
  "artifacts": [{"path": "hello.txt", "required": true}],
  "verification": {"required": true, "commands": [["test", "-f", "hello.txt"]]},
  "provenance": {"source_tool": "workcell", "source_version": "0.1.0", "artifact_refs": ["examples/hello/workcell.json"]},
  "redaction": {"policy": "workcell-default-redaction-v1", "redacted_fields": []},
  "idempotency_key": "pkg-workcell-hello-001:attempt:1"
}
